{
  "$schema": "https://adico.dev/schema/components.json/v1",
  "version": 1,
  "style": "default",
  "theme": { "tokens": "shadcn", "darkMode": "class" },
  "paths": {
    "components": "src/components",
    "ui": "src/components/ui",
    "lib": "src/lib",
    "hooks": "src/hooks"
  },
  "css": { "entry": "assets/tailwind.css", "framework": "tailwind" },
  "registries": { "@adico": { "kind": "embedded" } },
  "defaultRegistry": "@adico"
}
