{
  "$schema": "https://adico.awwwkshay.com/schema/components.json/v1",
  "version": 1,
  "style": "default",
  "theme": {
    "tokens": "shadcn",
    "darkMode": "class"
  },
  "paths": {
    "components": "src/components",
    "ui": "src/components/ui",
    "lib": "src/adico_lib",
    "hooks": "src/hooks"
  },
  "css": {
    "entry": "tailwind.css",
    "framework": "tailwind"
  },
  "registries": {
    "@adico": {
      "kind": "https",
      "url": "https://adico.awwwkshay.com/r/index.json"
    }
  },
  "defaultRegistry": "@adico"
}
